{
  "title": "项目绩效复盘：交付、投入与预算",
  "profile": "executive-dense",
  "lang": "zh-CN",
  "storyline": "project-update",
  "footer": "合成数据 · Project-authored synthetic dataset / Apache-2.0",
  "slides": [
    {
      "type": "cover",
      "title": "项目绩效复盘：交付、投入与预算",
      "source": "合成数据 · Project-authored synthetic dataset / Apache-2.0",
      "subtitle": "2026-09-01 至 2026-09-30 · 合成数据示例"
    },
    {
      "type": "kpi-dashboard",
      "title": "项目总览同时核对交付、人天与成本",
      "source": "合成数据 · Project-authored synthetic dataset / Apache-2.0",
      "items": [
        {
          "label": "交付量",
          "value": "25项",
          "delta": "计划 30项"
        },
        {
          "label": "投入人天",
          "value": "206",
          "delta": "计划 190"
        },
        {
          "label": "实际成本",
          "value": "270,200 元",
          "delta": "预算 290,000 元",
          "highlight": true
        },
        {
          "label": "成本差异",
          "value": "-19,800 元"
        },
        {
          "label": "已实现价值",
          "value": "缺失 / N/A"
        },
        {
          "label": "价值 / 成本",
          "value": "缺失 / N/A"
        }
      ]
    },
    {
      "type": "chart",
      "title": "交付计划与实际按项目同尺度比较",
      "source": "合成数据 · Project-authored synthetic dataset / Apache-2.0",
      "labels": [
        "平台升级",
        "渠道接入",
        "数据治理"
      ],
      "series": [
        {
          "name": "计划",
          "values": [
            12,
            8,
            10
          ]
        },
        {
          "name": "实际",
          "values": [
            10,
            8,
            7
          ]
        }
      ],
      "unit": "项",
      "period": "2026-09-01 至 2026-09-30",
      "insight": "交付量不代表质量或业务价值；须结合验收状态",
      "chartType": "bar"
    },
    {
      "type": "table",
      "title": "里程碑以截至日判断逾期，未完成不伪造成零天延误",
      "source": "合成数据 · Project-authored synthetic dataset / Apache-2.0",
      "headers": [
        "项目",
        "里程碑",
        "计划",
        "实际",
        "状态",
        "偏差天数"
      ],
      "rows": [
        [
          "平台升级",
          "阶段验收",
          "2026-09-15",
          "未完成",
          "逾期未完",
          "缺失 / N/A"
        ],
        [
          "渠道接入",
          "阶段验收",
          "2026-09-20",
          "2026-09-19",
          "按期完成",
          "-1"
        ],
        [
          "数据治理",
          "阶段验收",
          "2026-09-25",
          "2026-09-28",
          "延期完成",
          "3"
        ]
      ]
    },
    {
      "type": "chart",
      "title": "资源投入按计划与实际人天比较",
      "source": "合成数据 · Project-authored synthetic dataset / Apache-2.0",
      "labels": [
        "平台升级",
        "渠道接入",
        "数据治理"
      ],
      "series": [
        {
          "name": "计划人天",
          "values": [
            80,
            50,
            60
          ]
        },
        {
          "name": "实际人天",
          "values": [
            90,
            48,
            68
          ]
        }
      ],
      "unit": "人天",
      "period": "2026-09-01 至 2026-09-30",
      "insight": "成本 = 实际人天 × 日费率 + 外部费用",
      "chartType": "bar"
    },
    {
      "type": "table",
      "title": "预算与成本逐项保留，超支不等同于亏损",
      "source": "合成数据 · Project-authored synthetic dataset / Apache-2.0",
      "headers": [
        "项目",
        "预算 / 元",
        "成本 / 元",
        "差异 / 元",
        "使用率",
        "已实现价值 / 元",
        "价值成本比"
      ],
      "rows": [
        [
          "平台升级",
          "120,000",
          "118,000",
          "-2,000",
          "98.33%",
          "170,000",
          "1.44"
        ],
        [
          "渠道接入",
          "80,000",
          "62,600",
          "-17,400",
          "78.25%",
          "120,000",
          "1.92"
        ],
        [
          "数据治理",
          "90,000",
          "89,600",
          "-400",
          "99.56%",
          "缺失 / N/A",
          "缺失 / N/A"
        ]
      ]
    },
    {
      "type": "table",
      "title": "风险与交付量并列，缺失值保持可见",
      "source": "合成数据 · Project-authored synthetic dataset / Apache-2.0",
      "headers": [
        "项目",
        "风险",
        "计划交付",
        "实际交付",
        "差异"
      ],
      "rows": [
        [
          "平台升级",
          "high",
          "12",
          "10",
          "-2"
        ],
        [
          "渠道接入",
          "low",
          "8",
          "8",
          "0"
        ],
        [
          "数据治理",
          "medium",
          "10",
          "7",
          "-3"
        ]
      ]
    },
    {
      "type": "executive-summary",
      "title": "管理摘要聚焦偏差与待确认项",
      "source": "合成数据 · Project-authored synthetic dataset / Apache-2.0",
      "items": [
        {
          "title": "交付",
          "note": "实际 25项 / 计划 30项；不合并不同计量单位。"
        },
        {
          "title": "预算",
          "note": "实际成本 270,200 元，预算差异 -19,800 元。"
        },
        {
          "title": "投入产出",
          "note": "价值成本比 缺失 / N/A；仅使用用户声明的已实现价值，不推算未来收益。"
        }
      ]
    }
  ]
}
